{
  "$schema": "https://json-schema.org/draft/2020-12/schema",
  "$id": "https://jarod-os.invalid/contracts/v1/c7-tool-audit-entry.schema.json",
  "title": "Tool audit entry (the agent's AuditEntry)",
  "description": "PROVISIONAL. The line `executeGuardedTool` hands to its audit sink. Since V-02 (2026-10-23) EVERY call that reaches the gate leaves one, reads included. `decision` is a French, user-facing literal today and is expected to change when the journal is internationalised; `args` and `target` are masked (`redactValue` / `redactCommandText`) before they are cut. Closed field set: no token, no capability.",
  "type": "object",
  "required": [
    "sessionId",
    "tool",
    "args",
    "decision"
  ],
  "properties": {
    "sessionId": {
      "type": "string",
      "minLength": 1
    },
    "tool": {
      "type": "string",
      "pattern": "^[a-zA-Z0-9_-]{1,64}$"
    },
    "args": {
      "type": "string",
      "maxLength": 600,
      "description": "JSON of the arguments, masked then cut at 500 characters; a cut value ends with the marker `\n… [tronqué, N caractères de plus]`, so the bound is 500 plus the marker (measured: 537 for a 5000-character argument)."
    },
    "decision": {
      "enum": [
        "accordé",
        "refusé",
        "automatique",
        "bloqué (mode Plan)",
        "refusé (règle)",
        "autorisé (règle)",
        "sans accord",
        "annulé",
        "refusé (invalide)"
      ]
    },
    "ok": {
      "type": "boolean"
    },
    "callId": {
      "type": "string",
      "minLength": 1,
      "maxLength": 256,
      "description": "The model's tool-call id, the one the conversation shows (`tool_id` on the wire)."
    },
    "tier": {
      "enum": [
        "sensible",
        "audité",
        "ordinaire"
      ],
      "description": "What the tool declares: `dangerous` → sensible, `audited` → audité, otherwise ordinaire. Absent for an unknown tool."
    },
    "target": {
      "type": "string",
      "maxLength": 260,
      "description": "The tool's declared target (path, command, address…), masked then cut at 200 characters plus the marker."
    },
    "durationMs": {
      "type": "integer",
      "minimum": 0,
      "description": "From the call reaching the gate to this line, the wait for approval included."
    },
    "proof": {
      "enum": [
        "verified",
        "failed",
        "unverifiable"
      ]
    },
    "injection": {
      "type": "array",
      "minItems": 1,
      "uniqueItems": true,
      "items": {
        "enum": [
          "override-instructions",
          "addresses-assistant",
          "task-hijack",
          "fake-authority",
          "exfiltration-request",
          "tool-call-impersonation",
          "hidden-text",
          "audit-tampering"
        ]
      },
      "description": "V-04 (2026-10-23): injection categories found in the tool's OUTPUT by `@jarod/kernel/injection` (observe mode: the output reaches the model unchanged). Categories only, never an excerpt. Absent when nothing is found or the tool produced no output."
    }
  },
  "additionalProperties": false
}
